reports/medicare_per_capita_final.csv

state_abbr,state_name,population_2024,total_doctors,total_claims,total_drug_cost,average_drug_cost,spend_per_capita,claims_per_capita
NY,New York,20001419,79262,95240368,18174131280.85,190.82,908.64,4.76
CT,Connecticut,3674449,15841,17035961,3244608255.24,190.46,883.02,4.64
KY,Kentucky,4584046,16690,29539412,3992210902.29,135.15,870.89,6.44
PA,Pennsylvania,13045848,52365,72980145,11128347140.4,152.48,853.02,5.59
AL,Alabama,5163055,15158,29065240,4397971083.36,151.31,851.82,5.63
LA,Louisiana,4614878,17360,26733751,3909690765.3,146.25,847.19,5.79
WV,West Virginia,1767402,7232,11351963,1496997308.47,131.87,847.0,6.42
MA,Massachusetts,7138560,31536,32361931,5922202143.26,183.0,829.61,4.53
DC,District of Columbia,691310,3503,1896979,553407537.16,291.73,800.52,2.74
TN,Tennessee,7251291,24796,38950358,5659749784.66,145.31,780.52,5.37
MI,Michigan,10099962,38086,49623865,7821347988.71,157.61,774.39,4.91
MO,Missouri,6243544,21740,35463463,4833468352.89,136.29,774.15,5.68
ME,Maine,1408438,6130,6630454,1080557533.82,162.97,767.2,4.71
OH,Ohio,11860621,44830,62294899,9043071424.01,145.17,762.45,5.25
MS,Mississippi,2950172,9214,16922230,2244482966.12,132.64,760.8,5.74
SC,South Carolina,5490316,18757,26346501,4166797794.05,158.15,758.94,4.8
IN,Indiana,6934754,22476,35193853,5190809669.13,147.49,748.52,5.07
NC,North Carolina,11052061,37687,52430568,8138215348.3,155.22,736.35,4.74
FL,Florida,23265838,78092,113582265,16838937917.76,148.25,723.76,4.88
AR,Arkansas,3096080,10224,18241272,2169438736.56,118.93,700.71,5.89
DE,Delaware,1050123,3601,4469302,734247072.05,164.29,699.2,4.26
RI,Rhode Island,1110415,4762,5643841,753138286.18,133.44,678.25,5.08
NJ,New Jersey,9506354,29901,36124998,6263635159.9,173.39,658.89,3.8
GA,Georgia,11204208,30920,47568589,7304129570.3,153.55,651.91,4.25
OK,Oklahoma,4097758,12059,18322879,2667189114.78,145.57,650.89,4.47
WI,Wisconsin,5957168,21649,27394211,3840695529.68,140.2,644.72,4.6
VT,Vermont,646521,2364,2571367,416696788.04,162.05,644.52,3.98
NE,Nebraska,2005591,7052,9542119,1273191618.25,133.43,634.82,4.76
KS,Kansas,2965252,9893,14430363,1876455870.98,130.04,632.81,4.87
IA,Iowa,3230454,11531,16509676,1964928631.15,119.02,608.25,5.11
NH,New Hampshire,1408518,5987,5823419,851255910.51,146.18,604.36,4.13
IL,Illinois,12703033,42228,51867241,7536982736.27,145.31,593.32,4.08
SD,South Dakota,927110,3454,4301083,549489221.16,127.76,592.69,4.64
MN,Minnesota,5797405,21371,23094567,3286593997.1,142.31,566.91,3.98
MD,Maryland,6245314,21296,19675615,3420670237.25,173.85,547.72,3.15
HI,Hawaii,1434952,4000,3818948,780970046.83,204.5,544.25,2.66
AZ,Arizona,7556424,24665,25708782,4104362870.3,159.65,543.16,3.4
CA,California,39364774,113975,129565592,21262400164.58,164.11,540.14,3.29
OR,Oregon,4265324,16345,16099092,2292723349.5,142.41,537.53,3.77
VA,Virginia,8819642,27312,31922467,4685929475.77,146.79,531.31,3.62
ND,North Dakota,793387,3063,3786445,412252334.26,108.88,519.61,4.77
TX,Texas,31318578,75623,98638359,15746441933.72,159.64,502.78,3.15
ID,Idaho,2000872,6503,7048626,991203715.17,140.62,495.39,3.52
NV,Nevada,3253543,8591,9980111,1554229839.43,155.73,477.7,3.07
MT,Montana,1137557,4153,4467425,525099676.3,117.54,461.6,3.93
CO,Colorado,5988502,19390,16573710,2737455388.61,165.17,457.12,2.77
WA,Washington,7927958,27086,24783752,3562222028.97,143.73,449.32,3.13
NM,New Mexico,2126774,6781,6903978,947085835.02,137.18,445.32,3.25
AK,Alaska,736537,2359,1471084,265514492.56,180.49,360.49,2.0
UT,Utah,3502983,9107,8683564,1243336039.86,143.18,354.94,2.48
WY,Wyoming,586722,1881,1785327,189691985.54,106.25,323.31,3.04

README.md

## Core Analytical Findings

1. **Appalachian Utilization Volume:** Normalizing by population reveals that **Kentucky ($870.89/resident)** and **West Virginia ($847.00/resident)** dominate national spending due to extreme prescription volume intensity reaching **6.4 claims per resident** (nearly double California at 3.29).
2. **Washington D.C. Specialty Outlier:** Ranks in the national top 10 for per-capita spend ($800.52) despite having the low prescription volume  (2.74 claims/resident), driven by a national peak average prescription cost of **$291.73/claim**.
3. **Northeast Compounding Pressure:** **New York ($908.64)** and **Connecticut ($883.02)** lead overall national per-capita spending due to a combination of high claims frequency (~4.7 claims/resident) and elevated average claim costs (~$190/claim).